notation,name,description
WMOCore,Core data,Data that Members shall exchange on a free and unrestricted basis to underpin the services they provide for the protection of life and property and for the well-being of all nations. (Resolution 1 (Cg-Ext(2021)))
WMORecommended,Recommended data,Data that should also be exchanged by Members to support Earth system monitoring and prediction efforts. (Resolution 1 (Cg-Ext(2021)))
noLimitation,no limitation,No limitation on distribution or use
unknown,unknown,unknown
inapplicable,inapplicable,inapplicable
